{
  "request_id": "req-003",
  "task_id": "task-001",
  "project_id": "project-001",
  "deadline_at": "2026-08-26T15:00:00Z",
  "idempotency_key": "verify-task-001-unit-001",
  "payload": {
    "command_id": "cmd-003",
    "document_id": "drawing-001",
    "mode": "VERIFY",
    "operation": "verify.move.v1",
    "target_native_refs": [
      {
        "document_id": "drawing-001",
        "native_id": "2AF"
      }
    ],
    "preconditions": [
      {
        "type": "revision",
        "expected": 101
      }
    ]
  }
}
