{
  "request_id": "req-001",
  "task_id": "task-001",
  "project_id": "project-001",
  "actor_context": {
    "user": "alice",
    "role": "designer"
  },
  "correlation_ids": ["corr-1", "corr-2"],
  "deadline_at": "2026-08-26T15:00:00Z",
  "payload": {
    "command_id": "cmd-001",
    "document_id": "drawing-001",
    "mode": "READ",
    "operation": "context.current_selection",
    "target_native_refs": []
  }
}
